{
  "$schema": "../../../../schemas/metamap-projection-spec.schema.json",
  "schemaVersion": "1.0.0",
  "id": "urn:bindings:projection",
  "select": {
    "kinds": ["routing:command"]
  },
  "slots": [
    {
      "name": "handler",
      "relation": "routing:handled_by",
      "direction": "outgoing",
      "cardinality": "exactly-one",
      "targetKinds": ["routing:handler"]
    },
    {
      "name": "input",
      "relation": "routing:accepts",
      "direction": "outgoing",
      "cardinality": "exactly-one",
      "targetKinds": ["routing:schema"]
    },
    {
      "name": "endpoint",
      "relation": "routing:exposed_as",
      "direction": "outgoing",
      "cardinality": "exactly-one",
      "targetKinds": ["routing:endpoint"]
    }
  ]
}
